Topic,Count,Name,Representation,KeyBERT,Flan-T5,Llama2,Representative_Docs
19,743,19_financial_stock_market_trading,"['financial', 'stock', 'market', 'trading', 'credit', 'price', 'fraud', 'data', 'model', 'prices']","['volatility', 'stock market', 'financial markets', 'time series', 'stock prices', 'forecasting', 'predictive', 'investors', 'predicting', 'lstm']","['Financial Markets', '', '', '', '', '', '', '', '', '']","['Financial Market Trend Forecasting', '', '', '', '', '', '', '', '', '']","['  Prediction of stock price and stock price movement patterns has always been a\ncritical area of research. While the well-known efficient market hypothesis\nrules out any possibility of accurate prediction of stock prices, there are\nformal propositions in the literature demonstrating accurate modeling of the\npredictive systems that can enable us to predict stock prices with a very high\nlevel of accuracy. In this paper, we present a suite of deep learning-based\nregression models that yields a very high level of accuracy in stock price\nprediction. To build our predictive models, we use the historical stock price\ndata of a well-known company listed in the National Stock Exchange (NSE) of\nIndia during the period December 31, 2012 to January 9, 2015. The stock prices\nare recorded at five minutes intervals of time during each working day in a\nweek. Using these extremely granular stock price data, we build four\nconvolutional neural network (CNN) and five long- and short-term memory\n(LSTM)-based deep learning models for accurate forecasting of the future stock\nprices. We provide detailed results on the forecasting accuracies of all our\nproposed models based on their execution time and their root mean square error\n(RMSE) values.\n', '  Stock market forecasting is very important in the planning of business\nactivities. Stock price prediction has attracted many researchers in multiple\ndisciplines including computer science, statistics, economics, finance, and\noperations research. Recent studies have shown that the vast amount of online\ninformation in the public domain such as Wikipedia usage pattern, news stories\nfrom the mainstream media, and social media discussions can have an observable\neffect on investors opinions towards financial markets. The reliability of the\ncomputational models on stock market prediction is important as it is very\nsensitive to the economy and can directly lead to financial loss. In this\npaper, we retrieved, extracted, and analyzed the effects of news sentiments on\nthe stock market. Our main contributions include the development of a sentiment\nanalysis dictionary for the financial sector, the development of a\ndictionary-based sentiment analysis model, and the evaluation of the model for\ngauging the effects of news sentiments on stocks for the pharmaceutical market.\nUsing only news sentiments, we achieved a directional accuracy of 70.59% in\npredicting the trends in short-term stock price movement.\n', '  The financial market trend forecasting method is emerging as a hot topic in\nfinancial markets today. Many challenges still currently remain, and various\nresearches related thereto have been actively conducted. Especially, recent\nresearch of neural network-based financial market trend prediction has\nattracted much attention. However, previous researches do not deal with the\nfinancial market forecasting method based on LSTM which has good performance in\ntime series data. There is also a lack of comparative analysis in the\nperformance of neural network-based prediction techniques and traditional\nprediction techniques. In this paper, we propose a financial market trend\nforecasting method using LSTM and analyze the performance with existing\nfinancial market trend forecasting methods through experiments. This method\nprepares the input data set through the data preprocessing process so as to\nreflect all the fundamental data, technical data and qualitative data used in\nthe financial data analysis, and makes comprehensive financial market analysis\nthrough LSTM. In this paper, we experiment and compare performances of existing\nfinancial market trend forecasting models, and performance according to the\nfinancial market environment. In addition, we implement the proposed method\nusing open sources and platform and forecast financial market trends using\nvarious financial data indicators.\n']"
20,723,20_matrix_rank_pca_low rank,"['matrix', 'rank', 'pca', 'low rank', 'matrix completion', 'low', 'nmf', 'completion', 'principal', 'matrices']","['matrix completion', 'matrix factorization', 'rank matrices', 'sparse pca', 'rank approximation', 'rank matrix', 'robust pca', 'nonnegative matrix', 'matrices', 'matrix']","['Mathematical problems', '', '', '', '', '', '', '', '', '']","['Robust matrix completion', '', '', '', '', '', '', '', '', '']","['  Most recent results in matrix completion assume that the matrix under\nconsideration is low-rank or that the columns are in a union of low-rank\nsubspaces. In real-world settings, however, the linear structure underlying\nthese models is distorted by a (typically unknown) nonlinear transformation.\nThis paper addresses the challenge of matrix completion in the face of such\nnonlinearities. Given a few observations of a matrix that are obtained by\napplying a Lipschitz, monotonic function to a low rank matrix, our task is to\nestimate the remaining unobserved entries. We propose a novel matrix completion\nmethod that alternates between low-rank matrix estimation and monotonic\nfunction estimation to estimate the missing matrix elements. Mean squared error\nbounds provide insight into how well the matrix can be estimated based on the\nsize, rank of the matrix and properties of the nonlinear transformation.\nEmpirical results on synthetic and real-world datasets demonstrate the\ncompetitiveness of the proposed approach.\n', ""  Consider a movie recommendation system where apart from the ratings\ninformation, side information such as user's age or movie's genre is also\navailable. Unlike standard matrix completion, in this setting one should be\nable to predict inductively on new users/movies. In this paper, we study the\nproblem of inductive matrix completion in the exact recovery setting. That is,\nwe assume that the ratings matrix is generated by applying feature vectors to a\nlow-rank matrix and the goal is to recover back the underlying matrix.\nFurthermore, we generalize the problem to that of low-rank matrix estimation\nusing rank-1 measurements. We study this generic problem and provide conditions\nthat the set of measurements should satisfy so that the alternating\nminimization method (which otherwise is a non-convex method with no convergence\nguarantees) is able to recover back the {\\em exact} underlying low-rank matrix.\n  In addition to inductive matrix completion, we show that two other low-rank\nestimation problems can be studied in our framework: a) general low-rank matrix\nsensing using rank-1 measurements, and b) multi-label regression with missing\nlabels. For both the problems, we provide novel and interesting bounds on the\nnumber of measurements required by alternating minimization to provably\nconverges to the {\\em exact} low-rank matrix. In particular, our analysis for\nthe general low rank matrix sensing problem significantly improves the required\nstorage and computational cost than that required by the RIP-based matrix\nsensing methods \\cite{RechtFP2007}. Finally, we provide empirical validation of\nour approach and demonstrate that alternating minimization is able to recover\nthe true matrix for the above mentioned problems using a small number of\nmeasurements.\n"", '  Robust low-rank matrix completion (RMC), or robust principal component\nanalysis with partially observed data, has been studied extensively for\ncomputer vision, signal processing and machine learning applications. This\nproblem aims to decompose a partially observed matrix into the superposition of\na low-rank matrix and a sparse matrix, where the sparse matrix captures the\ngrossly corrupted entries of the matrix. A widely used approach to tackle RMC\nis to consider a convex formulation, which minimizes the nuclear norm of the\nlow-rank matrix (to promote low-rankness) and the l1 norm of the sparse matrix\n(to promote sparsity). In this paper, motivated by some recent works on\nlow-rank matrix completion and Riemannian optimization, we formulate this\nproblem as a nonsmooth Riemannian optimization problem over Grassmann manifold.\nThis new formulation is scalable because the low-rank matrix is factorized to\nthe multiplication of two much smaller matrices. We then propose an alternating\nmanifold proximal gradient continuation (AManPGC) method to solve the proposed\nnew formulation. The convergence rate of the proposed algorithm is rigorously\nanalyzed. Numerical results on both synthetic data and real data on background\nextraction from surveillance videos are reported to demonstrate the advantages\nof the proposed new formulation and algorithm over several popular existing\napproaches.\n']"
21,705,21_explanations_explanation_interpretability_interpretable,"['explanations', 'explanation', 'interpretability', 'interpretable', 'counterfactual', 'models', 'model', 'machine', 'black', 'explainability']","['counterfactual explanations', 'explainable ai', 'learning models', 'model agnostic', 'neural networks', 'explanation methods', 'explanations', 'explainability', 'prediction', 'predictive']","['Science/Tech', '', '', '', '', '', '', '', '', '']","['Science/Tech', '', '', '', '', '', '', '', '', '']","[""  With machine learning models being increasingly applied to various\ndecision-making scenarios, people have spent growing efforts to make machine\nlearning models more transparent and explainable. Among various explanation\ntechniques, counterfactual explanations have the advantages of being\nhuman-friendly and actionable -- a counterfactual explanation tells the user\nhow to gain the desired prediction with minimal changes to the input. Besides,\ncounterfactual explanations can also serve as efficient probes to the models'\ndecisions. In this work, we exploit the potential of counterfactual\nexplanations to understand and explore the behavior of machine learning models.\nWe design DECE, an interactive visualization system that helps understand and\nexplore a model's decisions on individual instances and data subsets,\nsupporting users ranging from decision-subjects to model developers. DECE\nsupports exploratory analysis of model decisions by combining the strengths of\ncounterfactual explanations at instance- and subgroup-levels. We also introduce\na set of interactions that enable users to customize the generation of\ncounterfactual explanations to find more actionable ones that can suit their\nneeds. Through three use cases and an expert interview, we demonstrate the\neffectiveness of DECE in supporting decision exploration tasks and instance\nexplanations.\n"", '  Systems based on artificial intelligence and machine learning models should\nbe transparent, in the sense of being capable of explaining their decisions to\ngain humans\' approval and trust. While there are a number of explainability\ntechniques that can be used to this end, many of them are only capable of\noutputting a single one-size-fits-all explanation that simply cannot address\nall of the explainees\' diverse needs. In this work we introduce a\nmodel-agnostic and post-hoc local explainability technique for black-box\npredictions called LIMEtree, which employs surrogate multi-output regression\ntrees. We validate our algorithm on a deep neural network trained for object\ndetection in images and compare it against Local Interpretable Model-agnostic\nExplanations (LIME). Our method comes with local fidelity guarantees and can\nproduce a range of diverse explanation types, including contrastive and\ncounterfactual explanations praised in the literature. Some of these\nexplanations can be interactively personalised to create bespoke, meaningful\nand actionable insights into the model\'s behaviour. While other methods may\ngive an illusion of customisability by wrapping, otherwise static, explanations\nin an interactive interface, our explanations are truly interactive, in the\nsense of allowing the user to ""interrogate"" a black-box model. LIMEtree can\ntherefore produce consistent explanations on which an interactive exploratory\nprocess can be built.\n', ""  Transparency is a fundamental requirement for decision making systems when\nthese should be deployed in the real world. It is usually achieved by providing\nexplanations of the system's behavior. A prominent and intuitive type of\nexplanations are counterfactual explanations. Counterfactual explanations\nexplain a behavior to the user by proposing actions -- as changes to the input\n-- that would cause a different (specified) behavior of the system. However,\nsuch explanation methods can be unstable with respect to small changes to the\ninput -- i.e. even a small change in the input can lead to huge or arbitrary\nchanges in the output and of the explanation. This could be problematic for\ncounterfactual explanations, as two similar individuals might get very\ndifferent explanations. Even worse, if the recommended actions differ\nconsiderably in their complexity, one would consider such unstable\n(counterfactual) explanations as individually unfair.\n  In this work, we formally and empirically study the robustness of\ncounterfactual explanations in general, as well as under different models and\ndifferent kinds of perturbations. Furthermore, we propose that plausible\ncounterfactual explanations can be used instead of closest counterfactual\nexplanations to improve the robustness and consequently the individual fairness\nof counterfactual explanations.\n""]"
22,691,22_privacy_private_differential privacy_differential,"['privacy', 'private', 'differential privacy', 'differential', 'differentially', 'differentially private', 'data', 'dp', 'utility', 'preserving']","['differential privacy', 'differentially private', 'private algorithms', 'privacy preserving', 'private learning', 'privacy loss', 'data privacy', 'synthetic data', 'privacy guarantees', 'sample complexity']","['Science/Tech', '', '', '', '', '', '', '', '', '']","['Privacy', '', '', '', '', '', '', '', '', '']","[""  Deep learning models are often trained on datasets that contain sensitive\ninformation such as individuals' shopping transactions, personal contacts, and\nmedical records. An increasingly important line of work therefore has sought to\ntrain neural networks subject to privacy constraints that are specified by\ndifferential privacy or its divergence-based relaxations. These privacy\ndefinitions, however, have weaknesses in handling certain important primitives\n(composition and subsampling), thereby giving loose or complicated privacy\nanalyses of training neural networks. In this paper, we consider a recently\nproposed privacy definition termed \\textit{$f$-differential privacy} [18] for a\nrefined privacy analysis of training neural networks. Leveraging the appealing\nproperties of $f$-differential privacy in handling composition and subsampling,\nthis paper derives analytically tractable expressions for the privacy\nguarantees of both stochastic gradient descent and Adam used in training deep\nneural networks, without the need of developing sophisticated techniques as [3]\ndid. Our results demonstrate that the $f$-differential privacy framework allows\nfor a new privacy analysis that improves on the prior analysis~[3], which in\nturn suggests tuning certain parameters of neural networks for a better\nprediction accuracy without violating the privacy budget. These theoretically\nderived improvements are confirmed by our experiments in a range of tasks in\nimage classification, text classification, and recommender systems. Python code\nto calculate the privacy cost for these experiments is publicly available in\nthe \\texttt{TensorFlow Privacy} library.\n"", '  Attacks that aim to identify the training data of public neural networks\nrepresent a severe threat to the privacy of individuals participating in the\ntraining data set. A possible protection is offered by anonymization of the\ntraining data or training function with differential privacy. However, data\nscientists can choose between local and central differential privacy and need\nto select meaningful privacy parameters $\\epsilon$ which is challenging for\nnon-privacy experts. We empirically compare local and central differential\nprivacy mechanisms under white- and black-box membership inference to evaluate\ntheir relative privacy-accuracy trade-offs. We experiment with several datasets\nand show that this trade-off is similar for both types of mechanisms. This\nsuggests that local differential privacy is a sound alternative to central\ndifferential privacy for differentially private deep learning, since small\n$\\epsilon$ in central differential privacy and large $\\epsilon$ in local\ndifferential privacy result in similar membership inference attack risk.\n', '  Differential privacy is a strong notion for privacy that can be used to prove\nformal guarantees, in terms of a privacy budget, $\\epsilon$, about how much\ninformation is leaked by a mechanism. However, implementations of\nprivacy-preserving machine learning often select large values of $\\epsilon$ in\norder to get acceptable utility of the model, with little understanding of the\nimpact of such choices on meaningful privacy. Moreover, in scenarios where\niterative learning procedures are used, differential privacy variants that\noffer tighter analyses are used which appear to reduce the needed privacy\nbudget but present poorly understood trade-offs between privacy and utility. In\nthis paper, we quantify the impact of these choices on privacy in experiments\nwith logistic regression and neural network models. Our main finding is that\nthere is a huge gap between the upper bounds on privacy loss that can be\nguaranteed, even with advanced mechanisms, and the effective privacy loss that\ncan be measured using current inference attacks. Current mechanisms for\ndifferentially private machine learning rarely offer acceptable utility-privacy\ntrade-offs with guarantees for complex learning tasks: settings that provide\nlimited accuracy loss provide meaningless privacy guarantees, and settings that\nprovide strong privacy guarantees result in useless models. Code for the\nexperiments can be found here: https://github.com/bargavj/EvaluatingDPML\n']"
23,662,23_energy_power_load_electricity,"['energy', 'power', 'load', 'electricity', 'forecasting', 'grid', 'wind', 'consumption', 'solar', 'smart']","['load forecasting', 'energy consumption', 'power grid', 'neural network', 'forecasting', 'renewable energy', 'power flow', 'ieee', 'machine learning', 'power systems']","['Science/Tech', '', '', '', '', '', '', '', '', '']","['Science/Tech', '', '', '', '', '', '', '', '', '']","[""  The rising demand for electricity and its essential nature in today's world\ncalls for intelligent home energy management (HEM) systems that can reduce\nenergy usage. This involves scheduling of loads from peak hours of the day when\nenergy consumption is at its highest to leaner off-peak periods of the day when\nenergy consumption is relatively lower thereby reducing the system's peak load\ndemand, which would consequently result in lesser energy bills, and improved\nload demand profile. This work introduces a novel way to develop a learning\nsystem that can learn from experience to shift loads from one time instance to\nanother and achieve the goal of minimizing the aggregate peak load. This paper\nproposes a Deep Reinforcement Learning (DRL) model for demand response where\nthe virtual agent learns the task like humans do. The agent gets feedback for\nevery action it takes in the environment; these feedbacks will drive the agent\nto learn about the environment and take much smarter steps later in its\nlearning stages. Our method outperformed the state of the art mixed integer\nlinear programming (MILP) for load peak reduction. The authors have also\ndesigned an agent to learn to minimize both consumers' electricity bills and\nutilities' system peak load demand simultaneously. The proposed model was\nanalyzed with loads from five different residential consumers; the proposed\nmethod increases the monthly savings of each consumer by reducing their\nelectricity bill drastically along with minimizing the peak load on the system\nwhen time shiftable loads are handled by the proposed method.\n"", '  The housing structures have changed with urbanization and the growth due to\nthe construction of high-rise buildings all around the world requires end-use\nappliance energy conservation and management in real-time. This shift also came\nalong with smart-meters which enabled the estimation of appliance-specific\npower consumption from the buildings aggregate power consumption reading.\nNon-intrusive load monitoring (NILM) or energy disaggregation is aimed at\nseparating the household energy measured at the aggregate level into\nconstituent appliances. Over the years, signal processing and machine learning\nalgorithms have been combined to achieve this. Incredible research and\npublications have been conducted on energy disaggregation, non-intrusive load\nmonitoring, home energy management and appliance classification. There exists\nan API, NILMTK, a reproducible benchmark algorithm for the same. Many other\napproaches to perform energy disaggregation has been adapted such as deep\nneural network architectures and big data approach for household energy\ndisaggregation. This paper provides a survey of the effective NILM system\nframeworks and reviews the performance of the benchmark algorithms in a\ncomprehensive manner. This paper also summarizes the wide application scope and\nthe effectiveness of the algorithmic performance on three publicly available\ndata sets.\n', '  Energy disaggregation, a.k.a. Non-Intrusive Load Monitoring, aims to separate\nthe energy consumption of individual appliances from the readings of a mains\npower meter measuring the total energy consumption of, e.g. a whole house.\nEnergy consumption of individual appliances can be useful in many applications,\ne.g., providing appliance-level feedback to the end users to help them\nunderstand their energy consumption and ultimately save energy. Recently, with\nthe availability of large-scale energy consumption datasets, various neural\nnetwork models such as convolutional neural networks and recurrent neural\nnetworks have been investigated to solve the energy disaggregation problem.\nNeural network models can learn complex patterns from large amounts of data and\nhave been shown to outperform the traditional machine learning methods such as\nvariants of hidden Markov models. However, current neural network methods for\nenergy disaggregation are either computational expensive or are not capable of\nhandling long-term dependencies. In this paper, we investigate the application\nof the recently developed WaveNet models for the task of energy disaggregation.\nBased on a real-world energy dataset collected from 20 households over two\nyears, we show that WaveNet models outperforms the state-of-the-art deep\nlearning methods proposed in the literature for energy disaggregation in terms\nof both error measures and computational cost. On the basis of energy\ndisaggregation, we then investigate the performance of two deep-learning based\nframeworks for the task of on/off detection which aims at estimating whether an\nappliance is in operation or not. Based on the same dataset, we show that for\nthe task of on/off detection the second framework, i.e., directly training a\nbinary classifier, achieves better performance in terms of F1 score.\n']"
