Topic,Count,Name,Representation,KeyBERT,Flan-T5,Llama2,Representative_Docs
-1,24377,-1_data_learning_model_models,"['data', 'learning', 'model', 'models', 'based', 'neural', 'training', 'network', 'networks', 'deep']","['neural network', 'neural networks', 'deep learning', 'convolutional', 'networks', 'neural', 'models', 'machine learning', 'model', 'representations']","['Science/Tech', '', '', '', '', '', '', '', '', '']","['A novel architecture for deep convolutional neural networks', '', '', '', '', '', '', '', '', '']","['  The history of deep learning has shown that human-designed problem-specific\nnetworks can greatly improve the classification performance of general neural\nmodels. In most practical cases, however, choosing the optimal architecture for\na given task remains a challenging problem. Recent architecture-search methods\nare able to automatically build neural models with strong performance but fail\nto fully appreciate the interaction between neural architecture and weights.\nThis work investigates the problem of disentangling the role of the neural\nstructure and its edge weights, by showing that well-trained architectures may\nnot need any link-specific fine-tuning of the weights. We compare the\nperformance of such weight-free networks (in our case these are binary networks\nwith {0, 1}-valued weights) with random, weight-agnostic, pruned and standard\nfully connected networks. To find the optimal weight-agnostic network, we use a\nnovel and computationally efficient method that translates the hard\narchitecture-search problem into a feasible optimization problem.More\nspecifically, we look at the optimal task-specific architectures as the optimal\nconfiguration of binary networks with {0, 1}-valued weights, which can be found\nthrough an approximate gradient descent strategy. Theoretical convergence\nguarantees of the proposed algorithm are obtained by bounding the error in the\ngradient approximation and its practical performance is evaluated on two\nreal-world data sets. For measuring the structural similarities between\ndifferent architectures, we use a novel spectral approach that allows us to\nunderline the intrinsic differences between real-valued networks and\nweight-free architectures.\n', '  Transfer learning for feature extraction can be used to exploit deep\nrepresentations in contexts where there is very few training data, where there\nare limited computational resources, or when tuning the hyper-parameters needed\nfor training is not an option. While previous contributions to feature\nextraction propose embeddings based on a single layer of the network, in this\npaper we propose a full-network embedding which successfully integrates\nconvolutional and fully connected features, coming from all layers of a deep\nconvolutional neural network. To do so, the embedding normalizes features in\nthe context of the problem, and discretizes their values to reduce noise and\nregularize the embedding space. Significantly, this also reduces the\ncomputational cost of processing the resultant representations. The proposed\nmethod is shown to outperform single layer embeddings on several image\nclassification tasks, while also being more robust to the choice of the\npre-trained model used for obtaining the initial features. The performance gap\nin classification accuracy between thoroughly tuned solutions and the\nfull-network embedding is also reduced, which makes of the proposed approach a\ncompetitive solution for a large set of applications.\n', '  Recently, with convolutional neural networks gaining significant achievements\nin many challenging machine learning fields, hand-crafted neural networks no\nlonger satisfy our requirements as designing a network will cost a lot, and\nautomatically generating architectures has attracted increasingly more\nattention and focus. Some research on auto-generated networks has achieved\npromising results. However, they mainly aim at picking a series of single\nlayers such as convolution or pooling layers one by one. There are many elegant\nand creative designs in the carefully hand-crafted neural networks, such as\nInception-block in GoogLeNet, residual block in residual network and dense\nblock in dense convolutional network. Based on reinforcement learning and\ntaking advantages of the superiority of these networks, we propose a novel\nautomatic process to design a multi-block neural network, whose architecture\ncontains multiple types of blocks mentioned above, with the purpose to do\nstructure learning of deep neural networks and explore the possibility whether\ndifferent blocks can be composed together to form a well-behaved neural\nnetwork. The optimal network is created by the Q-learning agent who is trained\nto sequentially pick different types of blocks. To verify the validity of our\nproposed method, we use the auto-generated multi-block neural network to\nconduct experiments on image benchmark datasets MNIST, SVHN and CIFAR-10 image\nclassification task with restricted computational resources. The results\ndemonstrate that our method is very effective, achieving comparable or better\nperformance than hand-crafted networks and advanced auto-generated neural\nnetworks.\n']"
0,6727,0_policy_reinforcement_reinforcement learning_learning,"['policy', 'reinforcement', 'reinforcement learning', 'learning', 'rl', 'agent', 'control', 'agents', 'reward', 'policies']","['reinforcement learning', 'policy gradient', 'imitation learning', 'learning rl', 'markov decision', 'deep reinforcement', 'multi agent', 'model based', 'dynamics', 'reinforcement']","['Reinforcement Learning', '', '', '', '', '', '', '', '', '']","['Reinforcement Learning', '', '', '', '', '', '', '', '', '']","[""  Reinforcement learning (RL) methods often rely on massive exploration data to\nsearch optimal policies, and suffer from poor sampling efficiency. This paper\npresents a mixed reinforcement learning (mixed RL) algorithm by simultaneously\nusing dual representations of environmental dynamics to search the optimal\npolicy with the purpose of improving both learning accuracy and training speed.\nThe dual representations indicate the environmental model and the state-action\ndata: the former can accelerate the learning process of RL, while its inherent\nmodel uncertainty generally leads to worse policy accuracy than the latter,\nwhich comes from direct measurements of states and actions. In the framework\ndesign of the mixed RL, the compensation of the additive stochastic model\nuncertainty is embedded inside the policy iteration RL framework by using\nexplored state-action data via iterative Bayesian estimator (IBE). The optimal\npolicy is then computed in an iterative way by alternating between policy\nevaluation (PEV) and policy improvement (PIM). The convergence of the mixed RL\nis proved using the Bellman's principle of optimality, and the recursive\nstability of the generated policy is proved via the Lyapunov's direct method.\nThe effectiveness of the mixed RL is demonstrated by a typical optimal control\nproblem of stochastic non-affine nonlinear systems (i.e., double lane change\ntask with an automated vehicle).\n"", ""  Reinforcement Learning (RL) based methods have seen their paramount successes\nin solving serial decision-making and control problems in recent years. For\nconventional RL formulations, Markov Decision Process (MDP) and\nstate-action-value function are the basis for the problem modeling and policy\nevaluation. However, several challenging issues still remain. Among most cited\nissues, the enormity of state/action space is an important factor that causes\ninefficiency in accurately approximating the state-action-value function. We\nobserve that although actions directly define the agents' behaviors, for many\nproblems the next state after a state transition matters more than the action\ntaken, in determining the return of such a state transition. In this regard, we\npropose a new learning paradigm, State Action Separable Reinforcement Learning\n(sasRL), wherein the action space is decoupled from the value function learning\nprocess for higher efficiency. Then, a light-weight transition model is learned\nto assist the agent to determine the action that triggers the associated state\ntransition. In addition, our convergence analysis reveals that under certain\nconditions, the convergence time of sasRL is $O(T^{1/k})$, where $T$ is the\nconvergence time for updating the value function in the MDP-based formulation\nand $k$ is a weighting factor. Experiments on several gaming scenarios show\nthat sasRL outperforms state-of-the-art MDP-based RL algorithms by up to\n$75\\%$.\n"", ""  Model-free deep reinforcement learning (RL) methods have been successful in a\nwide variety of simulated domains. However, a major obstacle facing deep RL in\nthe real world is their high sample complexity. Batch policy gradient methods\noffer stable learning, but at the cost of high variance, which often requires\nlarge batches. TD-style methods, such as off-policy actor-critic and\nQ-learning, are more sample-efficient but biased, and often require costly\nhyperparameter sweeps to stabilize. In this work, we aim to develop methods\nthat combine the stability of policy gradients with the efficiency of\noff-policy RL. We present Q-Prop, a policy gradient method that uses a Taylor\nexpansion of the off-policy critic as a control variate. Q-Prop is both sample\nefficient and stable, and effectively combines the benefits of on-policy and\noff-policy methods. We analyze the connection between Q-Prop and existing\nmodel-free algorithms, and use control variate theory to derive two variants of\nQ-Prop with conservative and aggressive adaptation. We show that conservative\nQ-Prop provides substantial gains in sample efficiency over trust region policy\noptimization (TRPO) with generalized advantage estimation (GAE), and improves\nstability over deep deterministic policy gradient (DDPG), the state-of-the-art\non-policy and off-policy methods, on OpenAI Gym's MuJoCo continuous control\nenvironments.\n""]"
1,2456,1_speech_audio_speaker_music,"['speech', 'audio', 'speaker', 'music', 'acoustic', 'recognition', 'asr', 'model', 'speech recognition', 'end']","['speech enhancement', 'speech recognition', 'automatic speech', 'speaker verification', 'encoder', 'convolutional', 'neural networks', 'neural network', 'voice', 'speech']","['A.W.A.E.A.S.A.', '', '', '', '', '', '', '', '', '']","['Speech enhancement', '', '', '', '', '', '', '', '', '']","['  End-to-end models for robust automatic speech recognition (ASR) have not been\nsufficiently well-explored in prior work. With end-to-end models, one could\nchoose to preprocess the input speech using speech enhancement techniques and\ntrain the model using enhanced speech. Another alternative is to pass the noisy\nspeech as input and modify the model architecture to adapt to noisy speech. A\nsystematic comparison of these two approaches for end-to-end robust ASR has not\nbeen attempted before. We address this gap and present a detailed comparison of\nspeech enhancement-based techniques and three different model-based adaptation\ntechniques covering data augmentation, multi-task learning, and adversarial\nlearning for robust ASR. While adversarial learning is the best-performing\ntechnique on certain noise types, it comes at the cost of degrading clean\nspeech WER. On other relatively stationary noise types, a new speech\nenhancement technique outperformed all the model-based adaptation techniques.\nThis suggests that knowledge of the underlying noise type can meaningfully\ninform the choice of adaptation technique.\n', ""  This paper proposes speaker-adaptive neural vocoders for parametric\ntext-to-speech (TTS) systems. Recently proposed WaveNet-based neural vocoding\nsystems successfully generate a time sequence of speech signal with an\nautoregressive framework. However, it remains a challenge to synthesize\nhigh-quality speech when the amount of a target speaker's training data is\ninsufficient. To generate more natural speech signals with the constraint of\nlimited training data, we propose a speaker adaptation task with an effective\nvariation of neural vocoding models. In the proposed method, a\nspeaker-independent training method is applied to capture universal attributes\nembedded in multiple speakers, and the trained model is then optimized to\nrepresent the specific characteristics of the target speaker. Experimental\nresults verify that the proposed TTS systems with speaker-adaptive neural\nvocoders outperform those with traditional source-filter model-based vocoders\nand those with WaveNet vocoders, trained either speaker-dependently or\nspeaker-independently. In particular, our TTS system achieves 3.80 and 3.77 MOS\nfor the Korean male and Korean female speakers, respectively, even though we\nuse only ten minutes' speech corpus for training the model.\n"", '  Variational auto-encoders (VAEs) are deep generative latent variable models\nthat can be used for learning the distribution of complex data. VAEs have been\nsuccessfully used to learn a probabilistic prior over speech signals, which is\nthen used to perform speech enhancement. One advantage of this generative\napproach is that it does not require pairs of clean and noisy speech signals at\ntraining. In this paper, we propose audio-visual variants of VAEs for\nsingle-channel and speaker-independent speech enhancement. We develop a\nconditional VAE (CVAE) where the audio speech generative process is conditioned\non visual information of the lip region. At test time, the audio-visual speech\ngenerative model is combined with a noise model based on nonnegative matrix\nfactorization, and speech enhancement relies on a Monte Carlo\nexpectation-maximization algorithm. Experiments are conducted with the recently\npublished NTCD-TIMIT dataset as well as the GRID corpus. The results confirm\nthat the proposed audio-visual CVAE effectively fuses audio and visual\ninformation, and it improves the speech enhancement performance compared with\nthe audio-only VAE model, especially when the speech signal is highly corrupted\nby noise. We also show that the proposed unsupervised audio-visual speech\nenhancement approach outperforms a state-of-the-art supervised deep learning\nmethod.\n']"
2,1785,2_label_labels_classification_multi label,"['label', 'labels', 'classification', 'multi label', 'data', 'classifier', 'learning', 'classifiers', 'class', 'ensemble']","['label learning', 'label classification', 'supervised learning', 'multi label', 'semi supervised', 'supervised', 'labeled data', 'random forest', 'classifiers', 'machine learning']","['Multi label classification', '', '', '', '', '', '', '', '', '']","['Multi-label classification', '', '', '', '', '', '', '', '', '']","['  In multi-label classification, where the evaluation of predictions is less\nstraightforward than in single-label classification, various meaningful, though\ndifferent, loss functions have been proposed. Ideally, the learning algorithm\nshould be customizable towards a specific choice of the performance measure.\nModern implementations of boosting, most prominently gradient boosted decision\ntrees, appear to be appealing from this point of view. However, they are mostly\nlimited to single-label classification, and hence not amenable to multi-label\nlosses unless these are label-wise decomposable. In this work, we develop a\ngeneralization of the gradient boosting framework to multi-output problems and\npropose an algorithm for learning multi-label classification rules that is able\nto minimize decomposable as well as non-decomposable loss functions. Using the\nwell-known Hamming loss and subset 0/1 loss as representatives, we analyze the\nabilities and limitations of our approach on synthetic data and evaluate its\npredictive performance on multi-label benchmarks.\n', '  Multi-label classification (MLC) is a generalization of standard\nclassification where multiple labels may be assigned to a given sample. In the\nreal world, it is more common to deal with noisy datasets than clean datasets,\ngiven how modern datasets are labeled by a large group of annotators on\ncrowdsourcing platforms, but little attention has been given to evaluating\nmulti-label classifiers with noisy labels. Exploiting label correlations now\nbecomes a standard component of a multi-label classifier to achieve competitive\nperformance. However, this component makes the classifier more prone to poor\ngeneralization - it overfits labels as well as label dependencies. We identify\nthree common real-world label noise scenarios and show how previous approaches\nper-form poorly with noisy labels. To address this issue, we present a\nContext-Based Multi-LabelClassifier (CbMLC) that effectively handles noisy\nlabels when learning label dependencies, without requiring additional\nsupervision. We compare CbMLC against other domain-specific state-of-the-art\nmodels on a variety of datasets, under both the clean and the noisy settings.\nWe show CbMLC yields substantial improvements over the previous methods in most\ncases.\n', '  Multi-label learning deals with the classification problems where each\ninstance can be assigned with multiple labels simultaneously. Conventional\nmulti-label learning approaches mainly focus on exploiting label correlations.\nIt is usually assumed, explicitly or implicitly, that the label sets for\ntraining instances are fully labeled without any missing labels. However, in\nmany real-world multi-label datasets, the label assignments for training\ninstances can be incomplete. Some ground-truth labels can be missed by the\nlabeler from the label set. This problem is especially typical when the number\ninstances is very large, and the labeling cost is very high, which makes it\nalmost impossible to get a fully labeled training set. In this paper, we study\nthe problem of large-scale multi-label learning with incomplete label\nassignments. We propose an approach, called MPU, based upon positive and\nunlabeled stochastic gradient descent and stacked models. Unlike prior works,\nour method can effectively and efficiently consider missing labels and label\ncorrelations simultaneously, and is very scalable, that has linear time\ncomplexities over the size of the data. Extensive experiments on two real-world\nmulti-label datasets show that our MPU model consistently outperform other\ncommonly-used baselines.\n']"
3,1611,3_segmentation_images_image_medical,"['segmentation', 'images', 'image', 'medical', 'imaging', 'cancer', 'mri', 'tumor', 'deep', 'ct']","['image segmentation', 'segmentation', 'convolutional neural', 'mri', 'medical imaging', 'deep learning', 'convolutional', 'imaging', 'medical images', 'medical image']","['Science/Tech', '', '', '', '', '', '', '', '', '']","['A novel architecture for deep learning for medical image segmentation', '', '', '', '', '', '', '', '', '']","['  Medical image segmentation is routinely performed to isolate regions of\ninterest, such as organs and lesions. Currently, deep learning is the state of\nthe art for automatic segmentation, but is usually limited by the need for\nsupervised training with large datasets that have been manually segmented by\ntrained clinicians. The goal of semi-superised and unsupervised image\nsegmentation is to greatly reduce, or even eliminate, the need for training\ndata and therefore to minimze the burden on clinicians when training\nsegmentation models. To this end we introduce a novel network architecture for\ncapable of unsupervised and semi-supervised image segmentation called\nTricycleGAN. This approach uses three generative models to learn translations\nbetween medical images and segmentation maps using edge maps as an intermediate\nstep. Distinct from other approaches based on generative networks, TricycleGAN\nrelies on shape priors rather than colour and texture priors. As such, it is\nparticularly well-suited for several domains of medical imaging, such as\nultrasound imaging, where commonly used visual cues may be absent. We present\nexperiments with TricycleGAN on a clinical dataset of kidney ultrasound images\nand the benchmark ISIC 2018 skin lesion dataset.\n', ""  Multi-modality is widely used in medical imaging, because it can provide\nmultiinformation about a target (tumor, organ or tissue). Segmentation using\nmultimodality consists of fusing multi-information to improve the segmentation.\nRecently, deep learning-based approaches have presented the state-of-the-art\nperformance in image classification, segmentation, object detection and\ntracking tasks. Due to their self-learning and generalization ability over\nlarge amounts of data, deep learning recently has also gained great interest in\nmulti-modal medical image segmentation. In this paper, we give an overview of\ndeep learning-based approaches for multi-modal medical image segmentation task.\nFirstly, we introduce the general principle of deep learning and multi-modal\nmedical image segmentation. Secondly, we present different deep learning\nnetwork architectures, then analyze their fusion strategies and compare their\nresults. The earlier fusion is commonly used, since it's simple and it focuses\non the subsequent segmentation network architecture. However, the later fusion\ngives more attention on fusion strategy to learn the complex relationship\nbetween different modalities. In general, compared to the earlier fusion, the\nlater fusion can give more accurate result if the fusion method is effective\nenough. We also discuss some common problems in medical image segmentation.\nFinally, we summarize and provide some perspectives on the future research.\n"", '  Creating large scale high-quality annotations is a known challenge in medical\nimaging. In this work, based on the CycleGAN algorithm, we propose leveraging\nannotations from one modality to be useful in other modalities. More\nspecifically, the proposed algorithm creates highly realistic synthetic CT\nimages (SynCT) from prostate MR images using unpaired data sets. By using SynCT\nimages (without segmentation labels) and MR images (with segmentation labels\navailable), we have trained a deep segmentation network for precise delineation\nof prostate from real CT scans. For the generator in our CycleGAN, the cycle\nconsistency term is used to guarantee that SynCT shares the identical\nmanually-drawn, high-quality masks originally delineated on MR images. Further,\nwe introduce a cost function based on structural similarity index (SSIM) to\nimprove the anatomical similarity between real and synthetic images. For\nsegmentation followed by the SynCT generation from CycleGAN, automatic\ndelineation is achieved through a 2.5D Residual U-Net. Quantitative evaluation\ndemonstrates comparable segmentation results between our SynCT and radiologist\ndrawn masks for real CT images, solving an important problem in medical image\nsegmentation field when ground truth annotations are not available for the\nmodality of interest.\n']"
