Topic,Count,Name,Representation,KeyBERT,Flan-T5,Llama2,Representative_Docs
69,233,69_convolutional_cnns_networks_cnn,"['convolutional', 'cnns', 'networks', 'cnn', 'layers', 'convolutional neural', 'layer', 'network', 'image', 'neural']","['networks cnns', 'cnn architectures', 'convolutional layers', 'convolutional neural', 'deep convolutional', 'convolutional networks', 'convolutional filters', 'convolution', 'cnns', 'convolutional']","['Diffusion neural networks', '', '', '', '', '', '', '', '', '']","['Deep Learning', '', '', '', '', '', '', '', '', '']","['  In this paper, we propose a fixed convolutional layer with an order of\nsmoothness not only for avoiding checkerboard artifacts in convolutional neural\nnetworks (CNNs) but also for enhancing the performance of CNNs, where the\nsmoothness of its filter kernel can be controlled by a parameter. It is\nwell-known that a number of CNNs generate checkerboard artifacts in both of two\nprocess: forward-propagation of upsampling layers and backward-propagation of\nstrided convolutional layers. The proposed layer can perfectly prevent\ncheckerboard artifacts caused by strided convolutional layers or upsampling\nlayers including transposed convolutional layers. In an image-classification\nexperiment with four CNNs: a simple CNN, VGG8, ResNet-18, and ResNet-101,\napplying the fixed layers to these CNNs is shown to improve the classification\nperformance of all CNNs. In addition, the fixed layer are applied to generative\nadversarial networks (GANs), for the first time. From image-generation results,\na smoother fixed convolutional layer is demonstrated to enable us to improve\nthe quality of images generated with GANs.\n', '  Deep convolutional neural networks have recently proven extremely competitive\nin challenging image recognition tasks. This paper proposes the epitomic\nconvolution as a new building block for deep neural networks. An epitomic\nconvolution layer replaces a pair of consecutive convolution and max-pooling\nlayers found in standard deep convolutional neural networks. The main version\nof the proposed model uses mini-epitomes in place of filters and computes\nresponses invariant to small translations by epitomic search instead of\nmax-pooling over image positions. The topographic version of the proposed model\nuses large epitomes to learn filter maps organized in translational\ntopographies. We show that error back-propagation can successfully learn\nmultiple epitomic layers in a supervised fashion. The effectiveness of the\nproposed method is assessed in image classification tasks on standard\nbenchmarks. Our experiments on Imagenet indicate improved recognition\nperformance compared to standard convolutional neural networks of similar\narchitecture. Our models pre-trained on Imagenet perform excellently on\nCaltech-101. We also obtain competitive image classification results on the\nsmall-image MNIST and CIFAR-10 datasets.\n', '  Building large models with parameter sharing accounts for most of the success\nof deep convolutional neural networks (CNNs). In this paper, we propose doubly\nconvolutional neural networks (DCNNs), which significantly improve the\nperformance of CNNs by further exploring this idea. In stead of allocating a\nset of convolutional filters that are independently learned, a DCNN maintains\ngroups of filters where filters within each group are translated versions of\neach other. Practically, a DCNN can be easily implemented by a two-step\nconvolution procedure, which is supported by most modern deep learning\nlibraries. We perform extensive experiments on three image classification\nbenchmarks: CIFAR-10, CIFAR-100 and ImageNet, and show that DCNNs consistently\noutperform other competing architectures. We have also verified that replacing\na convolutional layer with a doubly convolutional layer at any depth of a CNN\ncan improve its performance. Moreover, various design choices of DCNNs are\ndemonstrated, which shows that DCNN can serve the dual purpose of building more\naccurate models and/or reducing the memory footprint without sacrificing the\naccuracy.\n']"
70,230,70_translation_nmt_machine translation_neural machine,"['translation', 'nmt', 'machine translation', 'neural machine', 'english', 'bleu', 'languages', 'translation nmt', 'machine', 'language']","['translation models', 'translation model', 'translation systems', 'machine translation', 'translation nmt', 'translation task', 'monolingual data', 'translation tasks', 'translation', 'translation quality']","['machine translation', '', '', '', '', '', '', '', '', '']","['Neural Machine Translation', '', '', '', '', '', '', '', '', '']","['  Machine translation has many applications such as news translation, email\ntranslation, official letter translation etc. Commercial translators, e.g.\nGoogle Translation lags in regional vocabulary and are unable to learn the\nbilingual text in the source and target languages within the input. In this\npaper, a regional vocabulary-based application-oriented Neural Machine\nTranslation (NMT) model is proposed over the data set of emails used at the\nUniversity for communication over a period of three years. A state-of-the-art\nSequence-to-Sequence Neural Network for ML -> EN and EN -> ML translations is\ncompared with Google Translate using Gated Recurrent Unit Recurrent Neural\nNetwork machine translation model with attention decoder. The low BLEU score of\nGoogle Translation in comparison to our model indicates that the application\nbased regional models are better. The low BLEU score of EN -> ML of our model\nand Google Translation indicates that the Malay Language has complex language\nfeatures corresponding to English.\n', '  Many language pairs are low resource, meaning the amount and/or quality of\navailable parallel data is not sufficient to train a neural machine translation\n(NMT) model which can reach an acceptable standard of accuracy. Many works have\nexplored using the readily available monolingual data in either or both of the\nlanguages to improve the standard of translation models in low, and even high,\nresource languages. One of the most successful of such works is the\nback-translation that utilizes the translations of the target language\nmonolingual data to increase the amount of the training data. The quality of\nthe backward model which is trained on the available parallel data has been\nshown to determine the performance of the back-translation approach. Despite\nthis, only the forward model is improved on the monolingual target data in\nstandard back-translation. A previous study proposed an iterative\nback-translation approach for improving both models over several iterations.\nBut unlike in the traditional back-translation, it relied on both the target\nand source monolingual data. This work, therefore, proposes a novel approach\nthat enables both the backward and forward models to benefit from the\nmonolingual target data through a hybrid of self-learning and back-translation\nrespectively. Experimental results have shown the superiority of the proposed\napproach over the traditional back-translation method on English-German low\nresource neural machine translation. We also proposed an iterative\nself-learning approach that outperforms the iterative back-translation while\nalso relying only on the monolingual target data and require the training of\nless models.\n', '  An effective method to generate a large number of parallel sentences for\ntraining improved neural machine translation (NMT) systems is the use of the\nback-translations of the target-side monolingual data. The standard\nback-translation method has been shown to be unable to efficiently utilize the\navailable huge amount of existing monolingual data because of the inability of\ntranslation models to differentiate between the authentic and synthetic\nparallel data during training. Tagging, or using gates, has been used to enable\ntranslation models to distinguish between synthetic and authentic data,\nimproving standard back-translation and also enabling the use of iterative\nback-translation on language pairs that underperformed using standard\nback-translation. In this work, we approach back-translation as a domain\nadaptation problem, eliminating the need for explicit tagging. In the approach\n-- \\emph{tag-less back-translation} -- the synthetic and authentic parallel\ndata are treated as out-of-domain and in-domain data respectively and, through\npre-training and fine-tuning, the translation model is shown to be able to\nlearn more efficiently from them during training. Experimental results have\nshown that the approach outperforms the standard and tagged back-translation\napproaches on low resource English-Vietnamese and English-German neural machine\ntranslation.\n']"
71,222,71_manifold_manifold learning_manifolds_dimensional,"['manifold', 'manifold learning', 'manifolds', 'dimensional', 'data', 'dimensionality', 'isomap', 'dimension', 'embedding', 'reduction']","['manifold learning', 'data manifold', 'manifold structure', 'nonlinear dimensionality', 'manifolds', 'dimensionality reduction', 'manifold', 'dimensional manifold', 'intrinsic dimensionality', 'diffusion maps']","['Manifold learning', '', '', '', '', '', '', '', '', '']","['Manifold learning', '', '', '', '', '', '', '', '', '']","['  Modern sample points in many applications no longer comprise real vectors in\na real vector space but sample points of much more complex structures, which\nmay be represented as points in a space with a certain underlying geometric\nstructure, namely a manifold. Manifold learning is an emerging field for\nlearning the underlying structure. The study of manifold learning can be split\ninto two main branches: dimension reduction and manifold fitting. With the aim\nof combining statistics and geometry, we address the problem of manifold\nfitting in the ambient space. Inspired by the relation between the eigenvalues\nof the Laplace-Beltrami operator and the geometry of a manifold, we aim to find\na small set of points that preserve the geometry of the underlying manifold.\nFrom this relationship, we extend the idea of subsampling to sample points in\nhigh-dimensional space and employ the Moving Least Squares (MLS) approach to\napproximate the underlying manifold. We analyze the two core steps in our\nproposed method theoretically and also provide the bounds for the MLS approach.\nOur simulation results and theoretical analysis demonstrate the superiority of\nour method in estimating the underlying manifold.\n', '  Manifold learning is a hot research topic in the field of computer science\nand has many applications in the real world. A main drawback of manifold\nlearning methods is, however, that there is no explicit mappings from the input\ndata manifold to the output embedding. This prohibits the application of\nmanifold learning methods in many practical problems such as classification and\ntarget detection. Previously, in order to provide explicit mappings for\nmanifold learning methods, many methods have been proposed to get an\napproximate explicit representation mapping with the assumption that there\nexists a linear projection between the high-dimensional data samples and their\nlow-dimensional embedding. However, this linearity assumption may be too\nrestrictive. In this paper, an explicit nonlinear mapping is proposed for\nmanifold learning, based on the assumption that there exists a polynomial\nmapping between the high-dimensional data samples and their low-dimensional\nrepresentations. As far as we know, this is the first time that an explicit\nnonlinear mapping for manifold learning is given. In particular, we apply this\nto the method of Locally Linear Embedding (LLE) and derive an explicit\nnonlinear manifold learning algorithm, named Neighborhood Preserving Polynomial\nEmbedding (NPPE). Experimental results on both synthetic and real-world data\nshow that the proposed mapping is much more effective in preserving the local\nneighborhood information and the nonlinear geometry of the high-dimensional\ndata samples than previous work.\n', '  Traditional manifold learning algorithms assumed that the embedded manifold\nis globally or locally isometric to Euclidean space. Under this assumption,\nthey divided manifold into a set of overlapping local patches which are locally\nisometric to linear subsets of Euclidean space. By analyzing the global or\nlocal isometry assumptions it can be shown that the learnt manifold is a flat\nmanifold with zero Riemannian curvature tensor. In general, manifolds may not\nsatisfy these hypotheses. One major limitation of traditional manifold learning\nis that it does not consider the curvature information of manifold. In order to\nremove these limitations, we present our curvature-aware manifold learning\nalgorithm called CAML. The purpose of our algorithm is to break the local\nisometry assumption and to reduce the dimension of the general manifold which\nis not isometric to Euclidean space. Thus, our method adds the curvature\ninformation to the process of manifold learning. The experiments have shown\nthat our method CAML is more stable than other manifold learning algorithms by\ncomparing the neighborhood preserving ratios.\n']"
72,220,72_svm_support_support vector_svms,"['svm', 'support', 'support vector', 'svms', 'vector', 'vector machine', 'vector machines', 'machines', 'support vectors', 'classification']","['svm algorithm', 'svm models', 'svm model', 'svm training', 'svms', 'vector machines', 'vector machine', 'weighted svm', 'svm', 'machines svms']","['Science/Tech', '', '', '', '', '', '', '', '', '']","['NESVM', '', '', '', '', '', '', '', '', '']","['  In this paper, we have considered general k-piece-wise linear convex loss\nfunctions in SVM model for measuring the empirical risk. The resulting\nk-Piece-wise Linear loss Support Vector Machine (k-PL-SVM) model is an adaptive\nSVM model which can learn a suitable piece-wise linear loss function according\nto nature of the given training set. The k-PL-SVM models are general SVM models\nand existing popular SVM models, like C-SVM, LS-SVM and Pin-SVM models, are\ntheir particular cases. We have performed the extensive numerical experiments\nwith k-PL-SVM models for k = 2 and 3 and shown that they are improvement over\nexisting SVM models.\n', '  The generalization error bound of support vector machine (SVM) depends on the\nratio of radius and margin, while standard SVM only considers the maximization\nof the margin but ignores the minimization of the radius. Several approaches\nhave been proposed to integrate radius and margin for joint learning of feature\ntransformation and SVM classifier. However, most of them either require the\nform of the transformation matrix to be diagonal, or are non-convex and\ncomputationally expensive. In this paper, we suggest a novel approximation for\nthe radius of minimum enclosing ball (MEB) in feature space, and then propose a\nconvex radius-margin based SVM model for joint learning of feature\ntransformation and SVM classifier, i.e., F-SVM. An alternating minimization\nmethod is adopted to solve the F-SVM model, where the feature transformation is\nupdatedvia gradient descent and the classifier is updated by employing the\nexisting SVM solver. By incorporating with kernel principal component analysis,\nF-SVM is further extended for joint learning of nonlinear transformation and\nclassifier. Experimental results on the UCI machine learning datasets and the\nLFW face datasets show that F-SVM outperforms the standard SVM and the existing\nradius-margin based SVMs, e.g., RMM, R-SVM+ and R-SVM+{\\mu}.\n', '  Support vector machines (SVMs) are invaluable tools for many practical\napplications in artificial intelligence, e.g., classification and event\nrecognition. However, popular SVM solvers are not sufficiently efficient for\napplications with a great deal of samples as well as a large number of\nfeatures. In this paper, thus, we present NESVM, a fast gradient SVM solver\nthat can optimize various SVM models, e.g., classical SVM, linear programming\nSVM and least square SVM. Compared against SVM-Perf\n\\cite{SVM_Perf}\\cite{PerfML} (its convergence rate in solving the dual SVM is\nupper bounded by $\\mathcal O(1/\\sqrt{k})$, wherein $k$ is the number of\niterations.) and Pegasos \\cite{Pegasos} (online SVM that converges at rate\n$\\mathcal O(1/k)$ for the primal SVM), NESVM achieves the optimal convergence\nrate at $\\mathcal O(1/k^{2})$ and a linear time complexity. In particular,\nNESVM smoothes the non-differentiable hinge loss and $\\ell_1$-norm in the\nprimal SVM. Then the optimal gradient method without any line search is adopted\nto solve the optimization. In each iteration round, the current gradient and\nhistorical gradients are combined to determine the descent direction, while the\nLipschitz constant determines the step size. Only two matrix-vector\nmultiplications are required in each iteration round. Therefore, NESVM is more\nefficient than existing SVM solvers. In addition, NESVM is available for both\nlinear and nonlinear kernels. We also propose ""homotopy NESVM"" to accelerate\nNESVM by dynamically decreasing the smooth parameter and using the continuation\nmethod. Our experiments on census income categorization, indoor/outdoor scene\nclassification, event recognition and scene recognition suggest the efficiency\nand the effectiveness of NESVM. The MATLAB code of NESVM will be available on\nour website for further assessment.\n']"
73,220,73_feature selection_feature_selection_features,"['feature selection', 'feature', 'selection', 'features', 'selection methods', 'data', 'methods', 'method', 'subset', 'proposed']","['feature selection', 'feature subsets', 'unsupervised feature', 'subset features', 'selection algorithms', 'feature subset', 'big data', 'data mining', 'feature extraction', 'unsupervised']","['Science/Tech', '', '', '', '', '', '', '', '', '']","['feature selection', '', '', '', '', '', '', '', '', '']","[""  In machine learning and pattern recognition, feature selection has been a hot\ntopic in the literature. Unsupervised feature selection is challenging due to\nthe loss of labels which would supply the related information.How to define an\nappropriate metric is the key for feature selection. We propose a filter method\nfor unsupervised feature selection which is based on the Confidence Machine.\nConfidence Machine offers an estimation of confidence on a feature'reliability.\nIn this paper, we provide the math model of Confidence Machine in the context\nof feature selection, which maximizes the relevance and minimizes the\nredundancy of the selected feature. We compare our method against classic\nfeature selection methods Laplacian Score, Pearson Correlation and Principal\nComponent Analysis on benchmark data sets. The experimental results demonstrate\nthe efficiency and effectiveness of our method.\n"", '  Feature selection, as a data preprocessing strategy, has been proven to be\neffective and efficient in preparing data (especially high-dimensional data)\nfor various data mining and machine learning problems. The objectives of\nfeature selection include: building simpler and more comprehensible models,\nimproving data mining performance, and preparing clean, understandable data.\nThe recent proliferation of big data has presented some substantial challenges\nand opportunities to feature selection. In this survey, we provide a\ncomprehensive and structured overview of recent advances in feature selection\nresearch. Motivated by current challenges and opportunities in the era of big\ndata, we revisit feature selection research from a data perspective and review\nrepresentative feature selection algorithms for conventional data, structured\ndata, heterogeneous data and streaming data. Methodologically, to emphasize the\ndifferences and similarities of most existing feature selection algorithms for\nconventional data, we categorize them into four main groups: similarity based,\ninformation theoretical based, sparse learning based and statistical based\nmethods. To facilitate and promote the research in this community, we also\npresent an open-source feature selection repository that consists of most of\nthe popular feature selection algorithms\n(\\url{http://featureselection.asu.edu/}). Also, we use it as an example to show\nhow to evaluate feature selection algorithms. At the end of the survey, we\npresent a discussion about some open problems and challenges that require more\nattention in future research.\n', '  We are surrounded by huge amounts of large-scale high dimensional data. It is\ndesirable to reduce the dimensionality of data for many learning tasks due to\nthe curse of dimensionality. Feature selection has shown its effectiveness in\nmany applications by building simpler and more comprehensive model, improving\nlearning performance, and preparing clean, understandable data. Recently, some\nunique characteristics of big data such as data velocity and data variety\npresent challenges to the feature selection problem. In this paper, we envision\nthese challenges of feature selection for big data analytics. In particular, we\nfirst give a brief introduction about feature selection and then detail the\nchallenges of feature selection for structured, heterogeneous and streaming\ndata as well as its scalability and stability issues. At last, to facilitate\nand promote the feature selection research, we present an open-source feature\nselection repository (scikit-feature), which consists of most of current\npopular feature selection algorithms.\n']"
