Topic,Count,Name,Representation,KeyBERT,Flan-T5,Llama2,Representative_Docs
44,424,44_code_program_software_source code,"['code', 'program', 'software', 'source code', 'programs', 'source', 'language', 'bug', 'programming', 'developers']","['programming language', 'source code', 'programming languages', 'software engineering', 'neural program', 'program synthesis', 'embeddings', 'natural language', 'neural network', 'snippets']","['Science/Tech', '', '', '', '', '', '', '', '', '']","['Science/Tech', '', '', '', '', '', '', '', '', '']","['  Building deep learning models on source code has found many successful\nsoftware engineering applications, such as code search, code comment\ngeneration, bug detection, code migration, and so on. Current learning\ntechniques, however, have a major drawback that these models are mostly trained\non datasets labeled for particular downstream tasks, and code representations\nmay not be suitable for other tasks. While some techniques produce\nrepresentations from unlabeled code, they are far from satisfactory when\napplied to downstream tasks. Although certain techniques generate\nrepresentations from unlabeled code when applied to downstream tasks they are\nfar from satisfactory. This paper proposes InferCode to overcome the limitation\nby adapting the self-supervised learning mechanism to build source code model.\nThe key novelty lies in training code representations by predicting\nautomatically identified subtrees from the context of the ASTs. Subtrees in\nASTs are treated with InferCode as the labels for training code representations\nwithout any human labeling effort or the overhead of expensive graph\nconstruction, and the trained representations are no longer tied to any\nspecific downstream tasks or code units. We trained an InferCode model instance\nusing the Tree-based CNN as the encoder of a large set of Java code and applied\nit to downstream unsupervised tasks such as code clustering, code clone\ndetection, cross-language code search or reused under a transfer learning\nscheme to continue training the model weights for supervised tasks such as code\nclassification and method name prediction. Compared to previous code learning\ntechniques applied to the same downstream tasks, such as Code2Vec, Code2Seq,\nASTNN, higher performance results are achieved using our pre-trained InferCode\nmodel with a significant margin for most tasks including those involving\ndifferent programming languages.\n', '  Program comprehension is a fundamental task in software development and\nmaintenance processes. Software developers often need to understand a large\namount of existing code before they can develop new features or fix bugs in\nexisting programs. Being able to process programming language code\nautomatically and provide summaries of code functionality accurately can\nsignificantly help developers to reduce time spent in code navigation and\nunderstanding, and thus increase productivity. Different from natural language\narticles, source code in programming languages often follows rigid syntactical\nstructures and there can exist dependencies among code elements that are\nlocated far away from each other through complex control flows and data flows.\nExisting studies on tree-based convolutional neural networks (TBCNN) and gated\ngraph neural networks (GGNN) are not able to capture essential semantic\ndependencies among code elements accurately. In this paper, we propose novel\ntree-based capsule networks (TreeCaps) and relevant techniques for processing\nprogram code in an automated way that encodes code syntactical structures and\ncaptures code dependencies more accurately. Based on evaluation on programs\nwritten in different programming languages, we show that our TreeCaps-based\napproach can outperform other approaches in classifying the functionalities of\nmany programs.\n', '  Two key contributions presented in this paper are: i) A method for building a\ndataset containing source code features extracted from source files taken from\nOpen Source Software (OSS) and associated bug reports, ii) A predictive model\nfor estimating defectiveness of a given source code. These artifacts can be\nuseful for building tools and techniques pertaining to several automated\nsoftware engineering areas such as bug localization, code review, and\nrecommendation and program repair.\n  In order to achieve our goal, we first extract coding style information (e.g.\nrelated to programming language constructs used in the source code) for source\ncode files present on GitHub. Then the information available in bug reports (if\nany) associated with these source code files are extracted. Thus fetched un(/\nsemi)-structured information is then transformed into a structured knowledge\nbase. We considered more than 30400 source code files from 20 different GitHub\nrepositories with about 14950 associated bug reports across 4 bug tracking\nportals. The source code files considered are written in four programming\nlanguages (viz., C, C++, Java, and Python) and belong to different types of\napplications.\n  A machine learning (ML) model for estimating the defectiveness of a given\ninput source code is then trained using the knowledge base. In order to pick\nthe best ML model, we evaluated 8 different ML algorithms such as Random\nForest, K Nearest Neighbour and SVM with around 50 parameter configurations to\ncompare their performance on our tasks. One of our findings shows that best\nK-fold (with k=5) cross-validation results are obtained with the NuSVM\ntechnique that gives a mean F1 score of 0.914.\n']"
45,405,45_entity_knowledge_relation_entities,"['entity', 'knowledge', 'relation', 'entities', 'knowledge graph', 'knowledge graphs', 'relations', 'kg', 'graph', 'relation extraction']","['knowledge graphs', 'graph embedding', 'knowledge graph', 'embedding models', 'embeddings', 'embedding', 'kg embedding', 'knowledge bases', 'entity linking', 'relation extraction']","['Knowledge graph completion', '', '', '', '', '', '', '', '', '']","['Knowledge graphs', '', '', '', '', '', '', '', '', '']","['  Relation Extraction (RE) is a vital step to complete Knowledge Graph (KG) by\nextracting entity relations from texts.However, it usually suffers from the\nlong-tail issue. The training data mainly concentrates on a few types of\nrelations, leading to the lackof sufficient annotations for the remaining types\nof relations. In this paper, we propose a general approach to learn relation\nprototypesfrom unlabeled texts, to facilitate the long-tail relation extraction\nby transferring knowledge from the relation types with sufficient trainingdata.\nWe learn relation prototypes as an implicit factor between entities, which\nreflects the meanings of relations as well as theirproximities for transfer\nlearning. Specifically, we construct a co-occurrence graph from texts, and\ncapture both first-order andsecond-order entity proximities for embedding\nlearning. Based on this, we further optimize the distance from entity pairs\ntocorresponding prototypes, which can be easily adapted to almost arbitrary RE\nframeworks. Thus, the learning of infrequent or evenunseen relation types will\nbenefit from semantically proximate relations through pairs of entities and\nlarge-scale textual information.We have conducted extensive experiments on two\npublicly available datasets: New York Times and Google Distant\nSupervision.Compared with eight state-of-the-art baselines, our proposed model\nachieves significant improvements (4.1% F1 on average). Furtherresults on\nlong-tail relations demonstrate the effectiveness of the learned relation\nprototypes. We further conduct an ablation study toinvestigate the impacts of\nvarying components, and apply it to four basic relation extraction models to\nverify the generalization ability.Finally, we analyze several example cases to\ngive intuitive impressions as qualitative analysis. Our codes will be released\nlater.\n', '  Knowledge graph completion aims to predict missing relations between entities\nin a knowledge graph. In this work, we propose a relational message passing\nmethod for knowledge graph completion. Different from existing embedding-based\nmethods, relational message passing only considers edge features (i.e.,\nrelation types) without entity IDs in the knowledge graph, and passes\nrelational messages among edges iteratively to aggregate neighborhood\ninformation. Specifically, two kinds of neighborhood topology are modeled for a\ngiven entity pair under the relational message passing framework: (1)\nRelational context, which captures the relation types of edges adjacent to the\ngiven entity pair; (2) Relational paths, which characterize the relative\nposition between the given two entities in the knowledge graph. The two message\npassing modules are combined together for relation prediction. Experimental\nresults on knowledge graph benchmarks as well as our newly proposed dataset\nshow that, our method PathCon outperforms state-of-the-art knowledge graph\ncompletion methods by a large margin. PathCon is also shown applicable to\ninductive settings where entities are not seen in training stage, and it is\nable to provide interpretable explanations for the predicted results. The code\nand all datasets are available at https://github.com/hwwang55/PathCon.\n', '  We introduce a new method DOLORES for learning knowledge graph embeddings\nthat effectively captures contextual cues and dependencies among entities and\nrelations. First, we note that short paths on knowledge graphs comprising of\nchains of entities and relations can encode valuable information regarding\ntheir contextual usage. We operationalize this notion by representing knowledge\ngraphs not as a collection of triples but as a collection of entity-relation\nchains, and learn embeddings for entities and relations using deep neural\nmodels that capture such contextual usage. In particular, our model is based on\nBi-Directional LSTMs and learn deep representations of entities and relations\nfrom constructed entity-relation chains. We show that these representations can\nvery easily be incorporated into existing models to significantly advance the\nstate of the art on several knowledge graph prediction tasks like link\nprediction, triple classification, and missing relation type prediction (in\nsome cases by at least 9.5%).\n']"
46,382,46_satellite_remote sensing_images_remote,"['satellite', 'remote sensing', 'images', 'remote', 'crop', 'image', 'imagery', 'sensing', 'classification', 'land']","['satellite imagery', 'remote sensing', 'satellite images', 'multispectral', 'hyperspectral image', 'convolutional neural', 'hyperspectral', 'neural networks', 'deep learning', 'land cover']","['Science/Tech', '', '', '', '', '', '', '', '', '']","['Science/Tech', '', '', '', '', '', '', '', '', '']","['  Land cover mapping is essential to monitoring the environment and\nunderstanding the effects of human activities on it. The automatic approaches\nto land cover mapping (i.e., image segmentation) mostly used traditional\nmachine learning that requires heuristic feature design. On natural images,\ndeep learning has outperformed traditional machine learning approaches for\nimage segmentation. On remote sensing images, recent studies demonstrate\nsuccessful applications of specific deep learning models to small-scale land\ncover mapping tasks (e.g., to classify wetland complexes). However, it is not\nreadily clear which of the existing models are the best candidates for which\nremote sensing task. In this study, we answer that question for mapping the\nfundamental land cover classes using satellite radar data. We took Sentinel-1\nC-band SAR images available at no cost to users as representative data. CORINE\nland cover map was used as a reference, and the models were trained to\ndistinguish between the 5 major CORINE classes. We selected seven among the\nstate-of-the-art semantic segmentation models so that they cover a diverse set\nof approaches: U-Net, DeepLabV3+, PSPNet, BiSeNet, SegNet, FC-DenseNet, and\nFRRN-B. The models were pre-trained on the ImageNet dataset and further\nfine-tuned in this study. All the models demonstrated solid performance with\noverall accuracy between 87.9% and 93.1%, and with good to a very good\nagreement (kappa statistic between 0.75 and 0.86). The two best models were\nFC-DenseNet and SegNet, with the latter having a much smaller inference time.\nOverall, our results indicate that the semantic segmentation models are\nsuitable for efficient wide-area mapping using satellite SAR imagery and also\nprovide baseline accuracy against which the newly proposed models should be\nevaluated.\n', '  The increasing spatial and temporal resolution of globally available\nsatellite images, such as provided by Sentinel-2, creates new possibilities for\nresearchers to use freely available multi-spectral optical images, with\ndecametric spatial resolution and more frequent revisits for remote sensing\napplications such as land cover and crop classification (LC&CC), agricultural\nmonitoring and management, environment monitoring. Existing solutions dedicated\nto cropland mapping can be categorized based on per-pixel based and\nobject-based. However, it is still challenging when more classes of\nagricultural crops are considered at a massive scale. In this paper, a novel\nand optimal deep learning model for pixel-based LC&CC is developed and\nimplemented based on Recurrent Neural Networks (RNN) in combination with\nConvolutional Neural Networks (CNN) using multi-temporal sentinel-2 imagery of\ncentral north part of Italy, which has diverse agricultural system dominated by\neconomic crop types. The proposed methodology is capable of automated feature\nextraction by learning time correlation of multiple images, which reduces\nmanual feature engineering and modeling crop phenological stages. Fifteen\nclasses, including major agricultural crops, were considered in this study. We\nalso tested other widely used traditional machine learning algorithms for\ncomparison such as support vector machine SVM, random forest (RF), Kernal SVM,\nand gradient boosting machine, also called XGBoost. The overall accuracy\nachieved by our proposed Pixel R-CNN was 96.5%, which showed considerable\nimprovements in comparison with existing mainstream methods. This study showed\nthat Pixel R-CNN based model offers a highly accurate way to assess and employ\ntime-series data for multi-temporal classification tasks.\n', '  The land cover classification has played an important role in remote sensing\nbecause it can intelligently identify things in one huge remote sensing image\nto reduce the work of humans. However, a lot of classification methods are\ndesigned based on the pixel feature or limited spatial feature of the remote\nsensing image, which limits the classification accuracy and universality of\ntheir methods. This paper proposed a novel method to take into the information\nof remote sensing image, i.e., geographic latitude-longitude information. In\naddition, a dual-branch convolutional neural network (CNN) classification\nmethod is designed in combination with the global information to mine the pixel\nfeatures of the image. Then, the features of the two neural networks are fused\nwith another fully neural network to realize the classification of remote\nsensing images. Finally, two remote sensing images are used to verify the\neffectiveness of our method, including hyperspectral imaging (HSI) and\npolarimetric synthetic aperture radar (PolSAR) imagery. The result of the\nproposed method is superior to the traditional single-channel convolutional\nneural network.\n']"
47,380,47_pruning_compression_network_networks,"['pruning', 'compression', 'network', 'networks', 'pruned', 'sparsity', 'accuracy', 'neural', 'weight', 'neural networks']","['network pruning', 'channel pruning', 'pruning quantization', 'based pruning', 'neural networks', 'filter pruning', 'model compression', 'neural network', 'pruning methods', 'deep neural']","['Science/Tech', '', '', '', '', '', '', '', '', '']","['Neural Network Pruning', '', '', '', '', '', '', '', '', '']","['  Pruning neural network parameters is often viewed as a means to compress\nmodels, but pruning has also been motivated by the desire to prevent\noverfitting. This motivation is particularly relevant given the perhaps\nsurprising observation that a wide variety of pruning approaches increase test\naccuracy despite sometimes massive reductions in parameter counts. To better\nunderstand this phenomenon, we analyze the behavior of pruning over the course\nof training, finding that pruning\'s benefit to generalization increases with\npruning\'s instability (defined as the drop in test accuracy immediately\nfollowing pruning). We demonstrate that this ""generalization-stability\ntradeoff"" is present across a wide variety of pruning settings and propose a\nmechanism for its cause: pruning regularizes similarly to noise injection.\nSupporting this, we find less pruning stability leads to more model flatness\nand the benefits of pruning do not depend on permanent parameter removal. These\nresults explain the compatibility of pruning-based generalization improvements\nand the high generalization recently observed in overparameterized networks.\n', '  Modern deep networks have millions to billions of parameters, which leads to\nhigh memory and energy requirements during training as well as during inference\non resource-constrained edge devices. Consequently, pruning techniques have\nbeen proposed that remove less significant weights in deep networks, thereby\nreducing their memory and computational requirements. Pruning is usually\nperformed after training the original network, and is followed by further\nretraining to compensate for the accuracy loss incurred during pruning. The\nprune-and-retrain procedure is repeated iteratively until an optimum tradeoff\nbetween accuracy and efficiency is reached. However, such iterative retraining\nadds to the overall training complexity of the network. In this work, we\npropose a dynamic pruning-while-training procedure, wherein we prune filters of\nthe convolutional layers of a deep network during training itself, thereby\nprecluding the need for separate retraining. We evaluate our dynamic\npruning-while-training approach with three different pre-existing pruning\nstrategies, viz. mean activation-based pruning, random pruning, and L1\nnormalization-based pruning. Our results for VGG-16 trained on CIFAR10 shows\nthat L1 normalization provides the best performance among all the techniques\nexplored in this work with less than 1% drop in accuracy after pruning 80% of\nthe filters compared to the original network. We further evaluated the L1\nnormalization based pruning mechanism on CIFAR100. Results indicate that\npruning while training yields a compressed network with almost no accuracy loss\nafter pruning 50% of the filters compared to the original network and ~5% loss\nfor high pruning rates (>80%). The proposed pruning methodology yields 41%\nreduction in the number of computations and memory accesses during training for\nCIFAR10, CIFAR100 and ImageNet compared to training with retraining for 10\nepochs .\n', '  The rapidly growing parameter volume of deep neural networks (DNNs) hinders\nthe artificial intelligence applications on resource constrained devices, such\nas mobile and wearable devices. Neural network pruning, as one of the\nmainstream model compression techniques, is under extensive study to reduce the\nnumber of parameters and computations. In contrast to irregular pruning that\nincurs high index storage and decoding overhead, structured pruning techniques\nhave been proposed as the promising solutions. However, prior studies on\nstructured pruning tackle the problem mainly from the perspective of\nfacilitating hardware implementation, without analyzing the characteristics of\nsparse neural networks. The neglect on the study of sparse neural networks\ncauses inefficient trade-off between regularity and pruning ratio.\nConsequently, the potential of structurally pruning neural networks is not\nsufficiently mined.\n  In this work, we examine the structural characteristics of the irregularly\npruned weight matrices, such as the diverse redundancy of different rows, the\nsensitivity of different rows to pruning, and the positional characteristics of\nretained weights. By leveraging the gained insights as a guidance, we first\npropose the novel block-max weight masking (BMWM) method, which can effectively\nretain the salient weights while imposing high regularity to the weight matrix.\nAs a further optimization, we propose a density-adaptive regular-block (DARB)\npruning that outperforms prior structured pruning work with high pruning ratio\nand decoding efficiency. Our experimental results show that DARB can achieve\n13$\\times$ to 25$\\times$ pruning ratio, which are 2.8$\\times$ to 4.3$\\times$\nimprovements than the state-of-the-art counterparts on multiple neural network\nmodels and tasks. Moreover, DARB can achieve 14.3$\\times$ decoding efficiency\nthan block pruning with higher pruning ratio.\n']"
48,366,48_continual_forgetting_continual learning_catastrophic forgetting,"['continual', 'forgetting', 'continual learning', 'catastrophic forgetting', 'catastrophic', 'tasks', 'learning', 'task', 'incremental', 'new']","['continual learning', 'incremental learning', 'catastrophic forgetting', 'learned tasks', 'episodic memory', 'neural networks', 'forgetting previously', 'continual', 'generative replay', 'forgetting']","['Science/Tech', '', '', '', '', '', '', '', '', '']","['Science/Tech', '', '', '', '', '', '', '', '', '']","['  Most artificial intelligence models have limiting ability to solve new tasks\nfaster, without forgetting previously acquired knowledge. The recently emerging\nparadigm of continual learning aims to solve this issue, in which the model\nlearns various tasks in a sequential fashion. In this work, a novel approach\nfor continual learning is proposed, which searches for the best neural\narchitecture for each coming task via sophisticatedly designed reinforcement\nlearning strategies. We name it as Reinforced Continual Learning. Our method\nnot only has good performance on preventing catastrophic forgetting but also\nfits new tasks well. The experiments on sequential classification tasks for\nvariants of MNIST and CIFAR-100 datasets demonstrate that the proposed approach\noutperforms existing continual learning alternatives for deep networks.\n', '  Catastrophic forgetting in neural networks is a significant problem for\ncontinual learning. A majority of the current methods replay previous data\nduring training, which violates the constraints of an ideal continual learning\nsystem. Additionally, current approaches that deal with forgetting ignore the\nproblem of catastrophic remembering, i.e. the worsening ability to discriminate\nbetween data from different tasks. In our work, we introduce Relevance Mapping\nNetworks (RMNs) which are inspired by the Optimal Overlap Hypothesis. The\nmappings reflects the relevance of the weights for the task at hand by\nassigning large weights to essential parameters. We show that RMNs learn an\noptimized representational overlap that overcomes the twin problem of\ncatastrophic forgetting and remembering. Our approach achieves state-of-the-art\nperformance across all common continual learning datasets, even significantly\noutperforming data replay methods while not violating the constraints for an\nideal continual learning system. Moreover, RMNs retain the ability to detect\ndata from new tasks in an unsupervised manner, thus proving their resilience\nagainst catastrophic remembering.\n', '  Continual learning aims to learn continuously from a stream of tasks and data\nin an online-learning fashion, being capable of exploiting what was learned\npreviously to improve current and future tasks while still being able to\nperform well on the previous tasks. One common limitation of many existing\ncontinual learning methods is that they often train a model directly on all\navailable training data without validation due to the nature of continual\nlearning, thus suffering poor generalization at test time. In this work, we\npresent a novel framework of continual learning named ""Bilevel Continual\nLearning"" (BCL) by unifying a {\\it bilevel optimization} objective and a {\\it\ndual memory management} strategy comprising both episodic memory and\ngeneralization memory to achieve effective knowledge transfer to future tasks\nand alleviate catastrophic forgetting on old tasks simultaneously. Our\nextensive experiments on continual learning benchmarks demonstrate the efficacy\nof the proposed BCL compared to many state-of-the-art methods. Our\nimplementation is available at\nhttps://github.com/phquang/bilevel-continual-learning.\n']"
